{
  "admission": {
    "allow_baseline": true,
    "allow_suppressions": true,
    "require_suppression_ticket": true
  },
  "gate": {
    "blocked_capabilities": [
      "network.client-server",
      "process.execute"
    ],
    "blocked_rules": [],
    "maximum_skipped_files": null,
    "minimum_severity": "critical"
  },
  "ruleset_version": "2026-07-29.5",
  "schema_version": "1.0"
}
